
-------####--"Welcome to Address Book DataBase"--####---------------

-----------------------------# UC1: #-------------------------------------
mysql> CREATE DATABASE address_book_services;
Query OK, 1 row affected (0.07 sec)

mysql> show databases;
+--------------------------+
| Database                 |
+--------------------------+
| address_book_services    |
| information_schema       |
| mysql                    |
| payroll_service_database |
| performance_schema       |
| sys                      |
| temp                     |
+--------------------------+
7 rows in set (0.00 sec)

mysql> USE address_book_services;
Database changed
mysql> SELECT DATABASE();
+-----------------------+
| DATABASE()            |
+-----------------------+
| address_book_services |
+-----------------------+
1 row in set (0.00 sec)

-----------------------------# UC2: #-------------------------------------
mysql> CREATE TABLE AddressBookTables
    -> (
    -> id               INT unsigned NOT NULL AUTO_INCREMENT,
    -> FIRST_NAME       VARCHAR(100) NOT NULL,
    -> LAST_NAME        VARCHAR(100) NOT NULL,
    -> Address          VARCHAR(100) NOT NULL,
    -> City             VARCHAR(100) NOT NULL,
    -> State            VARCHAR(100) NOT NULL,
    -> Zip              INT(20) NOT NULL,
    -> Phone_Number     VARCHAR(50) NOT NULL,
    -> Email            VARCHAR(100) NOT NULL,
    -> PRIMARY KEY      (id)
    -> );
Query OK, 0 rows affected, 1 warning (1.16 sec)

mysql> DESCRIBE AddressBookTables;
+--------------+--------------+------+-----+---------+----------------+
| Field        | Type         | Null | Key | Default | Extra          |
+--------------+--------------+------+-----+---------+----------------+
| id           | int unsigned | NO   | PRI | NULL    | auto_increment |
| FIRST_NAME   | varchar(100) | NO   |     | NULL    |                |
| LAST_NAME    | varchar(100) | NO   |     | NULL    |                |
| Address      | varchar(100) | NO   |     | NULL    |                |
| City         | varchar(100) | NO   |     | NULL    |                |
| State        | varchar(100) | NO   |     | NULL    |                |
| Zip          | int          | NO   |     | NULL    |                |
| Phone_Number | varchar(50)  | NO   |     | NULL    |                |
| Email        | varchar(100) | NO   |     | NULL    |                |
+--------------+--------------+------+-----+---------+----------------+
9 rows in set (0.06 sec)

------------------------------------# UC3: #---------------------------------------------------------------------------
mysql> INSERT INTO AddressBookTables (FIRST_NAME, LAST_NAME, Address, City, State, Zip, Phone_Number, Email) VALUES
    -> ('Sanket','Bagde','Mulund','Mumbai','Maharashtra',400080,'8654885425','sanketbagde@gmail.com'),
    -> ('Sam','Roy','Bhandup','Mumbai','Maharashtra',400079,'9865789625','roySam@gmail.com'),
    -> ('Karan','Kapoor','Kamti','Nagpur','Maharashtra',400050,'9865885214','kkaran@gmail.com');
Query OK, 3 rows affected (0.08 sec)
Records: 3  Duplicates: 0  Warnings: 0

mysql> SELECT * FROM AddressBookTables;
+----+------------+-----------+---------+--------+-------------+--------+--------------+-----------------------+
| id | FIRST_NAME | LAST_NAME | Address | City   | State       | Zip    | Phone_Number | Email                 |
+----+------------+-----------+---------+--------+-------------+--------+--------------+-----------------------+
|  1 | Sanket     | Bagde     | Mulund  | Mumbai | Maharashtra | 400080 | 8654885425   | sanketbagde@gmail.com |
|  2 | Sam        | Roy       | Bhandup | Mumbai | Maharashtra | 400079 | 9865789625   | roySam@gmail.com      |
|  3 | Karan      | Kapoor    | Kamti   | Nagpur | Maharashtra | 400050 | 9865885214   | kkaran@gmail.com      |
+----+------------+-----------+---------+--------+-------------+--------+--------------+-----------------------+
3 rows in set (0.02 sec)

------------------------------------# UC4: #----------------------------------------------------------------------------
mysql> update AddressBookTables set Address = 'Nahur' where FIRST_NAME = 'Sam';
Query OK, 1 row affected (0.10 sec)
Rows matched: 1  Changed: 1  Warnings: 0

mysql> SELECT * FROM AddressBookTables;
+----+------------+-----------+---------+--------+-------------+--------+--------------+-----------------------+
| id | FIRST_NAME | LAST_NAME | Address | City   | State       | Zip    | Phone_Number | Email                 |
+----+------------+-----------+---------+--------+-------------+--------+--------------+-----------------------+
|  1 | Sanket     | Bagde     | Mulund  | Mumbai | Maharashtra | 400080 | 8654885425   | sanketbagde@gmail.com |
|  2 | Sam        | Roy       | Nahur   | Mumbai | Maharashtra | 400079 | 9865789625   | roySam@gmail.com      |
|  3 | Karan      | Kapoor    | Kamti   | Nagpur | Maharashtra | 400050 | 9865885214   | kkaran@gmail.com      |
+----+------------+-----------+---------+--------+-------------+--------+--------------+-----------------------+
3 rows in set (0.01 sec)

------------------------------------# UC5: #----------------------------------------------------------------------------
mysql> DELETE FROM AddressBookTables WHERE FIRST_NAME = 'Sanket';
Query OK, 1 row affected (0.07 sec)

mysql> SELECT * FROM AddressBookTables;
+----+------------+-----------+---------+--------+-------------+--------+--------------+------------------+
| id | FIRST_NAME | LAST_NAME | Address | City   | State       | Zip    | Phone_Number | Email            |
+----+------------+-----------+---------+--------+-------------+--------+--------------+------------------+
|  2 | Sam        | Roy       | Nahur   | Mumbai | Maharashtra | 400079 | 9865789625   | roySam@gmail.com |
|  3 | Karan      | Kapoor    | Kamti   | Nagpur | Maharashtra | 400050 | 9865885214   | kkaran@gmail.com |
+----+------------+-----------+---------+--------+-------------+--------+--------------+------------------+
2 rows in set (0.01 sec)

------------------------------------# UC6: #----------------------------------------------------------------------------
mysql> SELECT FIRST_NAME FROM AddressBookTables WHERE City = 'Mumbai';
+------------+
| FIRST_NAME |
+------------+
| Sam        |
| Sanket     |
+------------+
2 rows in set (0.00 sec)

mysql> SELECT FIRST_NAME FROM AddressBookTables WHERE State = 'Maharashtra';
+------------+
| FIRST_NAME |
+------------+
| Sam        |
| Karan      |
| Sanket     |
+------------+

------------------------------------# UC7: #----------------------------------------------------------------------------
mysql> SELECT  COUNT(City), COUNT(State) FROM AddressBookTables;
+-------------+--------------+
| COUNT(City) | COUNT(State) |
+-------------+--------------+
|           3 |            3 |
+-------------+--------------+
1 row in set (0.00 sec)
